Exercise Name,Day last selected,Modality,Cardio or Strength,Impact?,Anterior/Posterior,Station Number,Equipment,Equipment,KEY
Alternating Single Leg 1/2 Up/Down,,upper push,cardio,high impact,anterior,1,BW,,"Modality: can be upper push, upper pull, lower push, lower pull, or abs"
1 db single leg wall sit with curl and OH press on left foot,,lower push,strength,low impact,anterior,1,db,,"Cardio or Strength, as it says"
1 db single leg wall sit with curl and OH press on right foot,,lower push,strength,low impact,anterior,1,db,,"Impact: 1 means high impact, 0 means low impact"
180 jump turn,,lower push,cardio,high impact,,4,BW,,"Anterior/posterior, as it says, which chain are we targeting"
3 way lunge left,,lower push,strength,low impact,posterior,1,BW,,Station number is ints
3 way lunge right,,lower push,strength,low impact,posterior,4,BW,,"Equipment: all things required to do the movement, this will be strings"
90 turn jumps,,lower push,cardio,high impact,,5,BW,,
90 turn squat jumps,,lower push,cardio,high impact,posterior,4,BW,,
Barbell Reverse Curl with OH Press,,upper push,strength,low impact,anterior,4,barbell,,
Barbell Reverse Curl with Push Press,,upper push,strength,low impact,anterior,4,barbell,,
Barbell Squat Clean & OH Press,,upper push,strength,low impact,anterior,4,barbell,,
Barbell Squat with OH Press,,upper push,strength,low impact,anterior,4,barbell,,
Bike Climb,,,,low impact,,2,med ball,,
Block Jumps,,lower push,cardio,high impact,,4,BW,,
DB 1-db squat w 1 arm oh press left,,upper push,strength,low impact,anterior,1,db,,
DB 1-db squat w 1 arm oh press right,,upper push,strength,low impact,anterior,1,db,,
DB Alternating OH Press,,upper push,strength,low impact,anterior,1,db,,
DB Ankle Hops,,lower push,strength,high impact,,1,db,,
DB Push Press,,upper push,strength,low impact,anterior,1,db,,
DB RDL with Curl and OH Press,,upper push,strength,low impact,anterior,1,db,,
DB Reverse Lunge & OH Press,,upper push,strength,low impact,anterior,1,db,,
DB Squat Curl & OH Press,,upper push,strength,low impact,anterior,1,db,,
DB Stepping Lunge & OH Press,,upper push,strength,low impact,anterior,1,db,,
DB Stepping Lunge with Curl and OH Press,,upper push,strength,low impact,anterior,1,db,,
DB Up Down with OH Jump Press,,upper push,cardio,high impact,anterior,1,db,,
DB Up Down with OH Press,,upper push,cardio,high impact,anterior,1,db,,
DB squat w- oh press,,upper push,strength,low impact,anterior,1,db,,
Db 1-db squat curl and oh press left,,upper push,strength,low impact,anterior,1,db,,
Db 1-db squat curl and oh press right,,upper push,strength,low impact,anterior,1,db,,
Db squat jump,,lower push,strength,high impact,posterior,1,db,,
High Hurdle Linear Hop with 180 turn DO NOT TURN OVER HURDLE,,lower push,cardio,high impact,,5,hurdle,,
Lunge jumps,,lower push,cardio,high impact,posterior,5,BW,,
MB Squat Jump with OH Press,,upper push,strength,high impact,anterior,2,med ball,,
MB Up Down with Jump and Front Press,,upper push,cardio,high impact,anterior,2,med ball,,
MB Up Down with Jump,,upper push,cardio,high impact,anterior,2,med ball,,
MB Up Down with OH Jump Press,,upper push,cardio,high impact,anterior,2,med ball,,
MB half squat hold w front press,,upper push,strength,low impact,anterior,2,med ball,,
Modified V-Ups with hands on floor,,,,low impact,,4,BW,,
Single Leg Lunge Jump Right,,lower push,cardio,high impact,posterior,4,BW,,
Squat High Hurdle Lateral Hop Squat,,lower push,cardio,high impact,posterior,5,hurdle,,
Squat Jump,,lower push,cardio,high impact,posterior,4,BW,,
Squat Linear Low Hurdle Lat. Hop - Turn NO TURN ON JUMP,,lower push,cardio,high impact,posterior,5,hurdle,,
Squat Low Hurdle Lateral Hop Squat,,lower push,cardio,high impact,posterior,5,hurdle,,
Squat Low Hurdle Single Leg Hop Squat,,lower push,cardio,high impact,posterior,5,hurdle,,
Squat jump-hh lateral hop-squat jump,,lower push,cardio,high impact,posterior,4,BW,,
Squat- low hurdle lateral hop- squat,,lower push,cardio,high impact,posterior,5,hurdle,,
Stationary Lunge Left - Jump,,lower push,cardio,high impact,posterior,4,BW,,
Stationary Lunge Right - Jump,,lower push,cardio,high impact,posterior,1,BW,,
Stationary lunge with hip ext right,,lower push,strength,low impact,posterior,4,BW,,
Sumo Jump Squat,,lower push,cardio,high impact,posterior,5,BW,,
Tuck Jumps,,lower push,cardio,high impact,,1,BW,,
Up Down with Jump,,upper push,cardio,high impact,anterior,1,BW,,
Up down- HH lateral hop- up down,,upper push,cardio,high impact,anterior,4,BW,,
Versa Log Wall Sit,,lower push,strength,low impact,anterior,4,versabag,,
Versa Log lateral jump,,lower push,cardio,high impact,,4,versabag,,
WP Curl with Push Press,,upper push,strength,low impact,anterior,,plate,,
WP Push Press,,upper push,strength,low impact,anterior,,plate,,
WP Squat Curl and OH Press,,upper push,strength,low impact,anterior,,plate,,
WP Squat with OH Press,,upper push,strength,low impact,anterior,,plate,,
alternating single leg up down,,upper push,cardio,high impact,anterior,5,BW,,
ankle hops-max height,,lower push,cardio,high impact,,1,BW,,
ankle hops,,lower push,cardio,high impact,,4,BW,,
barbell bent over high row,,upper pull,strength,low impact,posterior,4,barbell,,
barbell bent over low row,,upper pull,strength,low impact,posterior,4,barbell,,
barbell floor press,,upper push,strength,low impact,anterior,4,barbell,,
barbell front squats,,lower push,strength,low impact,anterior,4,barbell,,
barbell jump squats,,lower push,cardio,high impact,posterior,4,barbell,,
barbell low speed squat,,lower push,strength,low impact,posterior,4,barbell,,
barbell lying tricep extension,,upper push,strength,low impact,posterior,4,barbell,,
barbell push press,,upper push,strength,low impact,anterior,4,barbell,,
barbell rdl w bent over row,,upper pull,strength,low impact,posterior,4,barbell,,
barbell rdl w upright row,,upper pull,strength,low impact,posterior,4,barbell,,
barbell rdls,,,strength,low impact,,4,barbell,,
barbell reverse lunge,,lower push,strength,low impact,posterior,4,barbell,,
barbell speed squat,,lower push,strength,low impact,posterior,4,barbell,,
barbell squat to clean,,lower push,strength,low impact,posterior,4,barbell,,
barbell squat with front raise,,lower push,strength,low impact,anterior,4,barbell,,
barbell squat,,lower push,strength,low impact,posterior,4,barbell,,
barbell stepping lunge w oh press,,upper push,strength,low impact,anterior,4,barbell,,
barbell stepping lunge,,lower push,strength,low impact,posterior,4,barbell,,
barbell upright row,,upper pull,strength,low impact,posterior,4,barbell,,
barbell wall sit with pr curl,,lower push,strength,low impact,anterior,4,barbell,,
bent knee oblique crunch left,,abs,strength,low impact,anterior,4,BW,,
bent knee oblique crunch right,,abs,strength,low impact,anterior,abs,BW,,
bent knee whole body crunch,,abs,strength,low impact,anterior,abs,BW,,
bicycle crunch with LEFT ONLY,,abs,strength,low impact,anterior,abs,BW,,
bicycle crunch with RIGHT ONLY,,abs,strength,low impact,anterior,4,BW,,
bicycle crunch,,abs,strength,low impact,anterior,4,BW,,
bike recovery,,,,low impact,,5,BW,,
bike sprint.wrong,,,,low impact,,1,BW,,
block jump w-180 turn,,lower push,cardio,high impact,,1,BW,,
block jump w-90 turn,,lower push,cardio,high impact,,1,BW,,
block squat,,lower push,strength,low impact,posterior,1,BW,,
boxing left left right right,,upper push,cardio,low impact,anterior,5,boxing gear,,
bridge walk outs,,lower push,strength,low impact,posterior,5,BW,,
bridge,,lower push,strength,low impact,posterior,4,BW,,
butt kick jumps,,lower push,cardio,high impact,,4,BW,,
caterpillar walk outs,,,,low impact,,1,BW,,
caterpillar walkout w 3 pushups,,upper push,strength,low impact,anterior,1,BW,,
caterpillar walkout w modified pushup,,upper push,strength,low impact,anterior,1,BW,,
caterpillar walkout w pushup,,upper push,strength,low impact,anterior,1,BW,,
crunch hold with feet on floor,,abs,strength,low impact,anterior,abs,BW,,
db 1 db half wall sit with front press,,lower push,strength,low impact,anterior,1,db,,
db 1 db lying tricep extension,,upper push,strength,low impact,posterior,1,db,,
db 1 db overhead half wall sit,,lower push,strength,low impact,anterior,1,db,,
db 1 db overhead wall sit,,lower push,strength,low impact,anterior,1,db,,
db 1 db squat with tricep extension,,upper push,strength,low impact,posterior,1,db,,
db 1 db wall sit with front press,,lower push,strength,low impact,anterior,1,db,,
db 1 db wall sit with steering wheel,,lower push,strength,low impact,anterior,1,db,,
db 1-db front press,,upper push,strength,low impact,anterior,1,db,,
db 1-db half squat with front press,,upper push,strength,low impact,anterior,1,db,,
db 1-db kneeling front press,,upper push,strength,low impact,anterior,1,db,,
db 1-db low sumo squat,,lower push,strength,low impact,posterior,1,db,,
db 1-db oh stepping lunge,,lower push,strength,low impact,posterior,1,db,,
db 1-db oh tricep extension,,upper push,strength,low impact,posterior,1,db,,
db 1-db out up press,,upper push,strength,low impact,anterior,1,db,,
db 1-db reverse lunge with front raise,,lower push,strength,low impact,posterior,1,db,,
db 12-15 upper body crunch,,abs,strength,low impact,anterior,abs,db,,
db alt bent over row 1 arm hold torso,,upper pull,strength,low impact,posterior,1,db,,
db alternating bent over row,,upper pull,strength,low impact,posterior,1,db,,
db alternating floor press,,upper push,strength,low impact,anterior,1,db,,
db alternating hammer curl,,upper pull,strength,low impact,anterior,1,db,,
db ankle hops-calf raises,,lower push,strength,high impact,,1,db,,
db bent over high row,,upper pull,strength,low impact,posterior,1,db,,
db bent over reverse flye,,,strength,low impact,,1,db,,
db diagonal lunge,,lower push,strength,low impact,posterior,1,db,,
db fast alternating curl,,upper pull,strength,low impact,anterior,1,db,,
db floor press with crunch,,upper push,strength,low impact,anterior,1,db,,
db floor press with straight leg crunch,,upper push,strength,low impact,anterior,1,db,,
db floor press,,upper push,strength,low impact,anterior,1,db,,
db front squat,,lower push,strength,low impact,anterior,1,db,,
db half squat hold w l-r air boxing,,upper push,cardio,low impact,anterior,5,db,boxing gear,
db half up down with modified push up and row,,upper push,cardio,high impact,anterior,1,db,,
db half up down with row,,upper push,cardio,high impact,anterior,1,db,,
db half wall sit with alternating curl,,lower push,strength,low impact,anterior,1,db,,
db half wall sit with curl,,lower push,strength,low impact,anterior,1,db,,
db half wall sit with hammer curl,,lower push,strength,low impact,anterior,1,db,,
db lateral lunge,,lower push,strength,low impact,posterior,1,db,,
db low jump squats,,lower push,strength,high impact,posterior,1,db,,
db lunge hold w curl left,,lower push,strength,low impact,posterior,1,db,,
db lunge hold w curl right,,lower push,strength,low impact,posterior,1,db,,
db lunge hold w row left,,lower push,strength,low impact,posterior,1,db,,
db lunge hold w row right,,lower push,strength,low impact,posterior,1,db,,
db lunge hold with curl left leg,,lower push,strength,low impact,posterior,1,db,,
db lunge hold with curl right leg,,lower push,strength,low impact,posterior,1,db,,
db lunge hold with oh press left,,upper push,strength,low impact,anterior,1,db,,
db lunge hold with oh press right,,upper push,strength,low impact,anterior,1,db,,
db lunge jumps,,lower push,strength,high impact,posterior,1,db,,
db modified push up hold with row and kickback,,upper push,strength,low impact,anterior,1,db,,
db modified push up with row and kickback,,upper push,strength,low impact,anterior,1,db,,
db modified push with row,,upper push,strength,low impact,anterior,1,db,,
db narrow grip floor press with crunch,,upper push,strength,low impact,anterior,1,db,,
db narrow grip floor press with straight leg crunch,,upper push,strength,low impact,anterior,1,db,,
db narrow grip floor press,,upper push,strength,low impact,anterior,1,db,,
db power lunge left,,lower push,strength,low impact,posterior,1,db,,
db push up hold with row and kickback,,upper push,strength,low impact,anterior,1,db,,
db push up hold with row,,upper push,strength,low impact,anterior,1,db,,
db push up with row and kickback,,upper push,strength,low impact,anterior,1,db,,
db push up with row,,upper push,strength,low impact,anterior,1,db,,
db rdl with upright row,,upper pull,strength,low impact,posterior,1,db,,
db rdl,,,strength,low impact,,1,db,,
db reverse lunge w curl right,,lower push,strength,low impact,posterior,1,db,,
db reverse lunge w curl,,lower push,strength,low impact,posterior,1,db,,
db reverse lunge with oh press left,,upper push,strength,low impact,anterior,1,db,,
db reverse lunge with oh press right,,upper push,strength,low impact,anterior,1,db,,
db reverse lunge with oh press,,upper push,strength,low impact,anterior,1,db,,
db reverse lunge,,lower push,strength,low impact,posterior,1,db,,
db single leg wall sit with curl and oh press with right leg,,lower push,strength,low impact,anterior,1,db,,
db squat hold w l r air boxing,,upper push,cardio,low impact,anterior,5,db,boxing gear,
db squat jump oh press,,upper push,strength,high impact,anterior,1,db,,
db squat w curl,,lower push,strength,low impact,posterior,1,db,,
db squat w upright row,,lower push,strength,low impact,posterior,1,db,,
db squat,,lower push,strength,low impact,posterior,1,db,,
db stationary lunge left,,lower push,strength,low impact,posterior,1,db,,
db stationary lunge right,,lower push,strength,low impact,posterior,1,db,,
db stationary lunge w curl left,,lower push,strength,low impact,posterior,1,db,,
db stationary lunge w curl right,,lower push,strength,low impact,posterior,1,db,,
db stationary lunge w hip ext left,,lower push,strength,low impact,posterior,1,db,,
db stationary lunge w hip ext right,,lower push,strength,low impact,posterior,1,db,,
db stationary lunge with oh press left,,upper push,strength,low impact,anterior,1,db,,
db stationary lunge with oh press right,,upper push,strength,low impact,anterior,1,db,,
db stepping lunge reverse lunge left,,lower push,strength,low impact,posterior,1,db,,
db stepping lunge reverse lunge right,,lower push,strength,low impact,posterior,1,db,,
db stepping lunge w curl left,,lower push,strength,low impact,posterior,1,db,,
db stepping lunge w curl right,,lower push,strength,low impact,posterior,1,db,,
db stepping lunge w curl,,lower push,strength,low impact,posterior,1,db,,
db stepping lunge w lateral raise,,lower push,strength,low impact,posterior,1,db,,
db stepping lunge with oh press left,,upper push,strength,low impact,anterior,1,db,,
db stepping lunge with oh press right,,upper push,strength,low impact,anterior,1,db,,
db stepping lunge,,lower push,strength,low impact,posterior,1,db,,
db straight leg alternate floor press,,upper push,strength,low impact,anterior,1,db,,
db straight leg floor press,,upper push,strength,low impact,anterior,1,db,,
db sumo squat w upright row,,lower push,strength,low impact,posterior,1,db,,
db up down w curl,,upper push,cardio,high impact,anterior,1,db,,
db up down w mod pushup and row,,upper push,cardio,high impact,anterior,1,db,,
db up down w pushup and jump squat,,upper push,cardio,high impact,anterior,1,db,,
db up down w pushup and row,,upper push,cardio,high impact,anterior,1,db,,
db up down w row,,upper push,cardio,high impact,anterior,1,db,,
db up down with curl and oh press,,upper push,cardio,high impact,anterior,1,db,,
db up down with row & jump squat,,upper push,cardio,high impact,anterior,1,db,,
db upright row,,upper pull,strength,low impact,posterior,1,db,,
db v sit hold with partial rep bicep curl with 1 foot on floor,,abs,strength,low impact,anterior,4,db,,
db v sit hold with partial rep bicep curl,,abs,strength,low impact,anterior,4,db,,
db wall sit with alternating curl,,lower push,strength,low impact,anterior,1,db,,
db wall sit with curl and overhead press,,lower push,strength,low impact,anterior,1,db,,
db wall sit with curl,,lower push,strength,low impact,anterior,1,db,,
db wall sit with fast alternating curl,,lower push,strength,low impact,anterior,1,db,,
db wall sit with hammer curl,,lower push,strength,low impact,anterior,1,db,,
diagonal half up down,,upper push,cardio,high impact,anterior,4,BW,,
dot jump with 180 turn,,lower push,cardio,high impact,,1,BW,,
dot jumps with no turn,,lower push,cardio,high impact,,5,BW,,
dot run,,lower pull,cardio,low impact,posterior,4,BW,,
double bicycle crunch,,abs,strength,low impact,anterior,4,BW,,
dumbbell modified push up hold with row,,upper push,strength,low impact,anterior,2,barbell,med ball,
elbow to knee twist crunch with left only,,abs,strength,low impact,anterior,abs,BW,,
elbow to knee twist crunch with right only,,abs,strength,low impact,anterior,4,BW,,
elbow to knee twist crunch,,abs,strength,low impact,anterior,4,BW,,
gremlin run,,lower pull,cardio,low impact,posterior,4,BW,,
hack squat hold,,lower push,strength,low impact,posterior,1,BW,,
hack squat sumo squat combo,,lower push,strength,low impact,posterior,2,med ball,,
half ROM crunch with feet off floor,,abs,strength,low impact,anterior,4,BW,,
half ROM crunch with feet on floor,,abs,strength,low impact,anterior,abs,BW,,
half ROM twist crunch,,abs,strength,low impact,anterior,abs,BW,,
half squat hold,,lower push,strength,low impact,posterior,5,BW,,
half squat with front kick,,lower push,strength,low impact,anterior,5,BW,,
half sumo squat hold,,lower push,strength,low impact,posterior,1,BW,,
half up down plank jack combo,,upper push,cardio,high impact,anterior,2,med ball,,
half up down with modified push up,,upper push,cardio,high impact,anterior,4,BW,,
half up down with push up,,upper push,cardio,high impact,anterior,4,BW,,
half up down,,upper push,cardio,high impact,anterior,4,BW,,
half wall sit with arms held out front,,lower push,strength,low impact,anterior,5,BW,,
half wall sit with foam roll,,lower push,strength,low impact,anterior,4,BW,,
high knees,,,,low impact,,5,BW,,
hip turns,,,,low impact,,5,BW,,
jogging butt kicks,,,,low impact,,5,BW,,
jumping jacks.good,,lower push,cardio,high impact,,5,BW,,
ladder 2 foot diagonal hops inside,,lower push,cardio,low impact,posterior,4,ladder,,
ladder 2 foot diagonal hops on outside,,lower push,cardio,low impact,posterior,4,ladder,,
ladder in and out fast feet,,lower push,cardio,low impact,posterior,4,ladder,,
ladder in and out hop backwards,,lower push,cardio,low impact,posterior,4,ladder,,
ladder in and out hop forward,,lower push,cardio,low impact,posterior,4,ladder,,
ladder in and out squat jacks backwards,,lower push,cardio,low impact,posterior,4,ladder,,
ladder in and out squat jacks,,lower push,cardio,low impact,posterior,4,ladder,,
ladder scissors,,lower push,cardio,low impact,posterior,4,ladder,,
ladder single leg diagonal hops inside,,lower push,cardio,low impact,posterior,4,ladder,,
lateral flexion shoulder blades down,,,,low impact,,4,BW,,
lateral lunge,,lower push,strength,low impact,posterior,5,BW,,
lateral skips,,lower push,cardio,high impact,,4,BW,,
linear jump to hack squat,,lower push,cardio,high impact,posterior,5,BW,,
linear low hurdle with no jump turn (do not turn over handle),,lower push,cardio,high impact,,5,hurdle,,
low hurdle lateral hop,,lower push,cardio,high impact,,5,hurdle,,
low hurdle single leg lateral hop,,lower push,cardio,high impact,,5,hurdle,,
low jump squat,,lower push,cardio,high impact,posterior,4,BW,,
low lateral skips,,lower push,cardio,high impact,,1,BW,,
low lunge jumps,,lower push,cardio,high impact,posterior,5,BW,,
low speed squat,,lower push,strength,low impact,posterior,1,BW,,
low sumo jump squat,,lower push,cardio,high impact,posterior,1,BW,,
low sumo squat,,lower push,strength,low impact,posterior,4,BW,,
lower body bicycle,,,,low impact,,1,BW,,
lower body crunch w sl pelvic lift,,abs,strength,low impact,anterior,4,BW,,
lower body crunch,,abs,strength,low impact,anterior,4,BW,,
lower body supermans with hands under chin,,,,low impact,,1,BW,,
marching half wall sit,,lower push,strength,low impact,anterior,4,BW,,
marching pelvic lift 120 degree bend in knee,,,,low impact,,1,BW,,
marching pelvic lift,,,,low impact,,4,BW,,
marching planks,,abs,,low impact,anterior,abs,BW,,
marching wall sit,,lower push,strength,low impact,anterior,5,BW,,
mb bent over row,,upper pull,strength,low impact,posterior,2,med ball,,
mb bicep curl,,upper pull,strength,low impact,anterior,2,med ball,,
mb bridge,,lower push,strength,low impact,posterior,2,med ball,,
mb curl oh press tricep extension,,upper push,strength,low impact,posterior,2,med ball,,
mb curl w front press,,upper push,strength,low impact,anterior,2,med ball,,
mb curl w oh press,,upper push,strength,low impact,anterior,2,med ball,,
mb diagonal chop left,,lower push,cardio,high impact,anterior,2,med ball,,
mb diagonal chop right,,lower push,cardio,high impact,anterior,2,med ball,,
mb front chop with jump,,lower push,cardio,high impact,anterior,2,med ball,,
mb front chop,,lower push,cardio,high impact,anterior,2,med ball,,
mb front press,,upper push,strength,low impact,anterior,2,med ball,,
mb half squat hold w curl,,lower push,strength,low impact,posterior,2,med ball,,
mb half squat hold,,lower push,strength,low impact,posterior,2,med ball,,
mb half wall sit with curl and overhead press,,lower push,strength,low impact,anterior,2,med ball,,
mb half wall sit with curl,,lower push,strength,low impact,anterior,2,med ball,,
mb jump squat,,lower push,cardio,high impact,posterior,2,med ball,,
mb kneeling big circles,,,,low impact,,2,med ball,,
mb lateral skip w front press,,upper push,strength,high impact,anterior,2,med ball,,
mb low sumo jump squat,,lower push,cardio,high impact,posterior,2,med ball,,
mb low sumo squat,,lower push,strength,low impact,posterior,2,med ball,,
mb lunge jump w oh press left,,upper push,strength,high impact,anterior,2,med ball,,
mb lunge jump w oh press right leg,,upper push,strength,high impact,anterior,2,med ball,,
mb lunge jump w oh press,,upper push,strength,high impact,anterior,2,med ball,,
mb modified rolling push up,,upper push,strength,low impact,anterior,2,med ball,,
mb modified traveling push up,,upper push,strength,low impact,anterior,2,med ball,,
mb oh calf raise,,upper push,strength,low impact,anterior,2,med ball,,
mb oh press w tricep ext,,upper push,strength,low impact,anterior,2,med ball,,
mb oh reverse lunge,,lower push,strength,low impact,posterior,2,med ball,,
mb oh stepping lunge,,lower push,strength,low impact,posterior,2,med ball,,
mb out up press,,upper push,strength,low impact,anterior,2,med ball,,
mb rdls,,,,low impact,,2,med ball,,
mb reverse lunge w front raise,,lower push,strength,low impact,posterior,2,med ball,,
mb reverse lunge w twist,,lower push,strength,low impact,posterior,2,med ball,,
mb reverse lunge with oh press at top,,upper push,strength,low impact,anterior,2,med ball,,
mb rolling push up,,upper push,strength,low impact,anterior,2,med ball,,
mb russian twist,,,,low impact,,2,med ball,,
mb single leg extension left,,lower push,strength,low impact,posterior,2,med ball,,
mb single leg hip extension right,,lower push,strength,low impact,posterior,2,med ball,,
mb single leg wall sit with curl and overhead press on left leg,,lower push,strength,low impact,anterior,2,med ball,,
mb speed bicep curl,,upper pull,strength,low impact,anterior,2,med ball,,
mb speed squat,,lower push,strength,low impact,posterior,2,med ball,,
mb squat curl oh press,,upper push,strength,low impact,anterior,2,med ball,,
mb squat hold w curl and front press,,upper push,strength,low impact,anterior,2,med ball,,
mb squat hold w curl,,lower push,strength,low impact,posterior,2,med ball,,
mb squat hold,,lower push,strength,low impact,posterior,2,med ball,,
mb squat jump w front press,,upper push,strength,high impact,anterior,2,med ball,,
mb squat w bicep curl,,lower push,strength,low impact,posterior,2,med ball,,
mb squat w front press at bottom,,upper push,strength,low impact,anterior,2,med ball,,
mb squat w front press at top,,upper push,strength,low impact,anterior,2,med ball,,
mb squat with oh press,,upper push,strength,low impact,anterior,2,med ball,,
mb squat,,lower push,strength,low impact,posterior,2,med ball,,
mb standing big circle,,,,low impact,,2,med ball,,
mb stepping lunge w twist,,lower push,strength,low impact,posterior,2,med ball,,
mb straight arm crunch with alternating hip flexion,,abs,strength,low impact,anterior,abs,med ball,,
mb sumo jump squat,,lower push,cardio,high impact,posterior,2,med ball,,
mb sumo squat hold w curl,,lower push,strength,low impact,posterior,2,med ball,,
mb sumo squat hold w front press,,upper push,strength,low impact,anterior,2,med ball,,
mb sumo squat hold,,lower push,strength,low impact,posterior,2,med ball,,
mb sumo squat w curl,,lower push,strength,low impact,posterior,2,med ball,,
mb sumo squat,,lower push,strength,low impact,posterior,2,med ball,,
mb traveling push up,,upper push,strength,low impact,anterior,2,med ball,,
mb tricep extension,,upper push,strength,low impact,posterior,2,med ball,,
mb up down w oh press,,upper push,cardio,high impact,anterior,2,med ball,,
mb up down,,upper push,cardio,high impact,anterior,2,med ball,,
mb v sit hold with front press and 1 foot down,,abs,strength,low impact,anterior,abs,med ball,,
mb v sit hold with front press and both feet up,,abs,strength,low impact,anterior,abs,med ball,,
mb v sit twist with 1 foot on floor,,abs,strength,low impact,anterior,4,med ball,,
mb v sit twist with both feet off floor,,abs,strength,low impact,anterior,abs,med ball,,
mb wall sit with curl and overhead press,,lower push,strength,low impact,anterior,2,med ball,,
