Exercise Name,Day last selected,Modality,Cardio or Strength,Impact?,Anterior/Posterior,Station Number,Equipment,Equipment,KEY
pulsing whole body crunch,,abs,strength,low impact,anterior,abs,BW,,
push up hold to side plank,,upper push,strength,low impact,anterior,4,BW,,
push up plank up combo,,upper push,strength,low impact,anterior,2,med ball,,
push up to side plank,,upper push,strength,low impact,anterior,4,BW,,
push up with shoulder touch and march,,upper push,strength,low impact,anterior,5,BW,,
rolling plank,,abs,,low impact,anterior,abs,BW,,
sb hip thrust hold with chest press,,upper push,strength,low impact,anterior,1,BW,,
sb low hack squat,,lower push,strength,low impact,posterior,4,BW,,
sb low speed squat,,lower push,strength,low impact,posterior,5,BW,,
single leg figure 8 dot jumps,,lower push,cardio,high impact,,1,BW,,
single leg pelvic lift right,,,,low impact,,1,BW,,
squat with versa log squeeze,,lower push,strength,low impact,posterior,4,versabag,,
stability ball alternating single leg squat,,lower push,strength,low impact,posterior,1,stability ball,,
stability ball hack squat,,lower push,strength,low impact,posterior,1,stability ball,,
stability ball hip thrust,,,,low impact,,1,stability ball,,
stability ball leg curl with hips up on curl,,upper pull,strength,low impact,anterior,1,stability ball,,
stability ball leg curl,,upper pull,strength,low impact,anterior,1,stability ball,,
stability ball pelvic lift,,,,low impact,,1,stability ball,,
stability ball power lunge left,,lower push,strength,low impact,posterior,1,stability ball,,
stability ball push up hold with hands on ball,,upper push,strength,low impact,anterior,1,stability ball,,
stability ball reverse lunge,,lower push,strength,low impact,posterior,1,stability ball,,
stability ball squat,,lower push,strength,low impact,posterior,1,stability ball,,
stationary lateral lunge,,lower push,strength,low impact,posterior,4,BW,,
step 1 db lying extension,,lower push,strength,low impact,posterior,2,steps,db,
step 2 db lying extension,,lower push,strength,low impact,posterior,2,steps,db,
step alternating single leg linear step jump,,lower push,cardio,high impact,,2,steps,,
step body bar chest press,,upper push,strength,low impact,anterior,2,steps,,
step body bar linear step up with oh press,,lower push,strength,low impact,posterior,2,steps,,
step body bar lying tricep extension,,upper push,strength,low impact,posterior,2,steps,,
step body bar squat lateral step squat,,lower push,strength,low impact,posterior,2,steps,,
step body bar step up with curl,,lower push,strength,low impact,posterior,2,steps,,
step body bar step up with hip flexion,,lower push,strength,low impact,posterior,2,steps,,
step calf raise,,,,low impact,,2,steps,,
step db chest flye,,,strength,low impact,,2,steps,db,
step db chest press,,upper push,strength,low impact,anterior,2,steps,db,
step db linear step up with oh press,,lower push,strength,low impact,posterior,2,steps,db,
step db step up with curl,,lower push,strength,low impact,posterior,2,steps,db,
step incline push ups with chest above step,,lower push,strength,low impact,posterior,2,steps,,
step jacks,,,,low impact,,2,steps,,
step lateral squat with abduction left,,lower push,strength,low impact,posterior,2,steps,,
step lateral squat with abduction right,,lower push,strength,low impact,posterior,2,steps,,
step lateral step jump,,lower push,cardio,high impact,,2,steps,,
step lateral step tap,,,,low impact,,2,steps,,
step lateral step up with abduction left,,lower push,strength,low impact,posterior,2,steps,,
step lateral step up with abduction right,,lower push,strength,low impact,posterior,2,steps,,
step lateral step up with hip flexion left,,lower push,strength,low impact,posterior,2,steps,,
step lateral step up with hip flexion right,,lower push,strength,low impact,posterior,2,steps,,
step linear step jump,,lower push,cardio,high impact,,2,steps,,
step linear step run,,lower pull,cardio,low impact,posterior,2,steps,,
step linear step tap,,,,low impact,,2,steps,,
step low crab walk up,,lower push,strength,low impact,posterior,2,steps,,
step mb lateral squat with abduction and curl left,,lower push,strength,low impact,posterior,2,steps,med ball,
step mb lateral squat with abduction and curl right,,lower push,strength,low impact,posterior,2,steps,med ball,
step mb lateral squat with oh press with left,,upper push,strength,low impact,anterior,2,steps,med ball,
step mb lateral squat with oh press with right,,upper push,strength,low impact,anterior,2,steps,med ball,
step mb lateral step run,,lower pull,cardio,low impact,posterior,2,steps,med ball,
step mb lateral step up with abduction and OH press right,,lower push,strength,low impact,posterior,2,steps,med ball,
step mb lateral step up with abduction and curl left,,lower push,strength,low impact,posterior,2,steps,med ball,
step mb lateral step up with abduction and curl right,,lower push,strength,low impact,posterior,2,steps,med ball,
step mb lateral step up with abduction and oh press with left,,lower push,strength,low impact,posterior,2,steps,med ball,
step mb linear step run,,lower pull,cardio,low impact,posterior,2,steps,med ball,
step mb linear step up with front press,,lower push,strength,low impact,posterior,2,steps,med ball,
step mb linear step up with oh press,,lower push,strength,low impact,posterior,2,steps,med ball,
step mb oh lateral step,,upper push,strength,low impact,anterior,2,steps,med ball,
step mb single leg linear step jump with oh press left,,upper push,strength,high impact,anterior,2,steps,med ball,
step mb single leg linear step jump with oh press right,,upper push,strength,high impact,anterior,2,steps,med ball,
step mb squat with front press lateral step squat with front press,,upper push,strength,low impact,anterior,2,steps,med ball,
step mb squat with front press lateral step up squat with front press,,lower push,strength,low impact,posterior,2,steps,med ball,
step modified step plyo push up,,lower push,strength,low impact,posterior,2,steps,,
step modified step walk ups with hip extension,,lower push,strength,low impact,posterior,2,steps,,
step modified step walk ups,,lower push,strength,low impact,posterior,2,steps,,
step modified traveling step plyo push up,,lower push,strength,low impact,posterior,2,steps,,
step modified traveling step push ups,,lower push,strength,low impact,posterior,2,steps,,
step prone lateral step jumps,,lower push,cardio,high impact,,2,steps,,
step reverse step walk ups,,lower push,strength,low impact,posterior,2,steps,,
step single leg lateral step jump with hip flexion with the left,,lower push,cardio,high impact,,2,steps,,
step single leg lateral step jump with hip flexion with the right,,lower push,cardio,high impact,,2,steps,,
step single leg linear step jump with left,,lower push,cardio,high impact,,2,steps,,
step single leg linear step jump with right,,lower push,cardio,high impact,,2,steps,,
step single leg linear step up left,,lower push,strength,low impact,posterior,2,steps,,
step single leg linear step up right,,lower push,strength,low impact,posterior,2,steps,,
step single leg linear step up with hip flexion left,,lower push,strength,low impact,posterior,2,steps,,
step single leg linear step up with hip flexion right,,lower push,strength,low impact,posterior,2,steps,,
step single leg step dips,,,,low impact,,2,steps,,
step split squat left,,lower push,strength,low impact,posterior,2,steps,,
step split squat right,,lower push,strength,low impact,posterior,2,steps,,
step squat lateral step jump squat,,lower push,cardio,high impact,posterior,2,steps,,
step squat lateral step squat,,lower push,strength,low impact,posterior,2,steps,,
step squat lateral step up squat,,lower push,strength,low impact,posterior,2,steps,,
step squat linear step jump squat,,lower push,cardio,high impact,posterior,2,steps,,
step squat linear step up squat,,lower push,strength,low impact,posterior,2,steps,,
step step decline push ups,,lower push,strength,low impact,posterior,2,steps,,
step step dips,,,,low impact,,2,steps,,
step step plank jack,,abs,,low impact,anterior,abs,steps,,
step step up down with lateral step jump,,lower push,strength,low impact,posterior,2,steps,,
step step up down with push up and lateral step jump,,lower push,strength,low impact,posterior,2,steps,,
step step up with hip flexion and extension,,lower push,strength,low impact,posterior,2,steps,,
step step walk up with hip extension,,lower push,strength,low impact,posterior,2,steps,,
step step walk ups,,lower push,strength,low impact,posterior,2,steps,,
step traveling step push up,,lower push,strength,low impact,posterior,2,steps,,
step up with hip extension,,lower push,strength,low impact,posterior,2,steps,,
step versa bag lateral step run,,lower pull,cardio,low impact,posterior,2,steps,versabag,
step versa bag linear step run,,lower pull,cardio,low impact,posterior,2,steps,versabag,
step versa bag single leg lateral step up with hip flexion left,,lower push,strength,low impact,posterior,2,steps,versabag,
step versa bag single leg lateral step up with hip flexion right,,lower push,strength,low impact,posterior,2,steps,versabag,
step versa bag single leg step up with hip extension left,,lower push,strength,low impact,posterior,2,steps,versabag,
step versa bag single leg step up with hip extension right,,lower push,strength,low impact,posterior,2,steps,versabag,
step versa bag single leg step up with hip flexion left,,lower push,strength,low impact,posterior,2,steps,versabag,
step versa bag single leg step up with hip flexion right,,lower push,strength,low impact,posterior,2,steps,versabag,
step versa bag squat lateral step squat,,lower push,strength,low impact,posterior,2,steps,versabag,
step versa bag squat lateral step up squat,,lower push,strength,low impact,posterior,2,steps,versabag,
step versa bag squat linear step up squat,,lower push,strength,low impact,posterior,2,steps,versabag,
step versa bag step up with hip extension,,lower push,strength,low impact,posterior,2,steps,versabag,
step versa bag step up with hip flexion,,lower push,strength,low impact,posterior,2,steps,versabag,
step wide push up step walk up tricep push up,,lower push,strength,low impact,posterior,2,steps,,
step wp chest press,,upper push,strength,low impact,anterior,2,steps,plate,
step wp lateral step run,,lower pull,strength,low impact,posterior,2,steps,plate,
step wp lateral step up with curl,,lower push,strength,low impact,posterior,2,steps,plate,
step wp linear step run,,lower pull,strength,low impact,posterior,2,steps,plate,
step wp linear step up with curl,,lower push,strength,low impact,posterior,2,steps,plate,
step wp linear step up with oh press,,lower push,strength,low impact,posterior,2,steps,plate,
step wp partial rep chest press,,upper push,strength,low impact,anterior,2,steps,plate,
step wp single leg lateral step up with hip flexion left,,lower push,strength,low impact,posterior,2,steps,plate,
step wp single leg lateral step up with hip flexion right,,lower push,strength,low impact,posterior,2,steps,plate,
step wp single leg step up left leg,,lower push,strength,low impact,posterior,2,steps,plate,
step wp single leg step up with hip extension left,,lower push,strength,low impact,posterior,2,steps,plate,
step wp single leg step up with hip extension right,,lower push,strength,low impact,posterior,2,steps,plate,
step wp single leg step up with hip flexion left,,lower push,strength,low impact,posterior,2,steps,plate,
step wp single leg step up with hip flexion right,,lower push,strength,low impact,posterior,2,steps,plate,
step wp single leg step up with right leg,,lower push,strength,low impact,posterior,2,steps,plate,
step wp squat lateral step squat,,lower push,strength,low impact,posterior,2,steps,plate,
step wp squat lateral step up squat,,lower push,strength,low impact,posterior,2,steps,plate,
step wp squat linear step up squat,,lower push,strength,low impact,posterior,2,steps,plate,
step wp step up with curl,,lower push,strength,low impact,posterior,2,steps,plate,
step wp step up with hip extension,,lower push,strength,low impact,posterior,2,steps,plate,
step wp step up with hip flexion,,lower push,strength,low impact,posterior,2,steps,plate,
suspension 120 degree bridge HOLD,,lower push,strength,low impact,posterior,3,suspension,,
suspension 90 degree press hold with hip extension,,lower push,strength,low impact,posterior,3,suspension,,
suspension alligators,,,,low impact,,3,suspension,,
suspension alternating low single leg squats,,lower push,strength,low impact,posterior,3,suspension,,
suspension alternating single leg curls,,upper pull,strength,low impact,anterior,3,suspension,,
suspension alternating single leg squat with bicep curl,,lower push,strength,low impact,posterior,3,suspension,,
suspension alternating single leg squat with high row,,lower push,strength,low impact,posterior,3,suspension,,
suspension alternating single leg squat with low row,,lower push,strength,low impact,posterior,3,suspension,,
suspension alternating single leg squats,,lower push,strength,low impact,posterior,3,suspension,,
suspension bicep curl crunch,,upper pull,strength,low impact,anterior,3,suspension,,
suspension bicep curl low row combo,,upper pull,strength,low impact,anterior,2,suspension,med ball,
suspension bicep curl,,upper pull,strength,low impact,anterior,3,suspension,,
suspension bridge,,lower push,strength,low impact,posterior,3,suspension,,
suspension chest flye tricep extension combo,,upper push,strength,low impact,posterior,2,suspension,med ball,
suspension chest flye,,,,low impact,,3,suspension,,
suspension chest press chest flye combo,,upper push,strength,low impact,anterior,2,suspension,med ball,
suspension chest press hold 45 degrees,,upper push,strength,low impact,anterior,3,suspension,,
suspension chest press hold 90 degrees,,upper push,strength,low impact,anterior,3,suspension,,
suspension chest press narrow grip chest press combo,,upper push,strength,low impact,anterior,2,suspension,med ball,
suspension diagonal half up down,,upper push,cardio,high impact,anterior,3,suspension,,
suspension eccentric chest flye,,,,low impact,,3,suspension,,
suspension eccentric reverse flye,,,,low impact,,3,suspension,,
suspension hack squat hold,,lower push,strength,low impact,posterior,3,suspension,,
suspension hack squat with bicep curl,,lower push,strength,low impact,posterior,3,suspension,,
suspension hack squat with high row,,lower push,strength,low impact,posterior,3,suspension,,
suspension hack squat with lat sweep,,lower push,strength,low impact,posterior,3,suspension,,
suspension hack squat with low row,,lower push,strength,low impact,posterior,3,suspension,,
suspension hack squat,,lower push,strength,low impact,posterior,3,suspension,,
suspension half hack squat hold,,lower push,strength,low impact,posterior,3,suspension,,
suspension half rom chest press,,upper push,strength,low impact,anterior,3,suspension,,
suspension half rom high row,,upper pull,strength,low impact,posterior,3,suspension,,
suspension half rom low row,,upper pull,strength,low impact,posterior,3,suspension,,
suspension half squat hold with bicep curl,,lower push,strength,low impact,posterior,3,suspension,,
suspension half squat hold with high row,,lower push,strength,low impact,posterior,3,suspension,,
suspension half squat hold with low row,,lower push,strength,low impact,posterior,3,suspension,,
suspension half squat hold with partial rep high row,,lower push,strength,low impact,posterior,3,suspension,,
suspension half squat hold with partial rep low row,,lower push,strength,low impact,posterior,3,suspension,,
suspension half squat hold with reverse flye,,lower push,strength,low impact,posterior,3,suspension,,
suspension half squat hold,,lower push,strength,low impact,posterior,3,suspension,,
suspension half up down,,upper push,cardio,high impact,anterior,3,suspension,,
suspension high row bicep curl combo,,upper pull,strength,low impact,anterior,2,suspension,med ball,
suspension high row hold at 90 degrees,,upper pull,strength,low impact,posterior,3,suspension,,
suspension high row low row combo,,upper pull,strength,low impact,posterior,2,suspension,med ball,
suspension high row,,upper pull,strength,low impact,posterior,3,suspension,,
suspension lat sweeps,,,,low impact,,3,suspension,,
suspension leg curl,,upper pull,strength,low impact,anterior,3,suspension,,
suspension low hack squat with bicep curl,,lower push,strength,low impact,posterior,3,suspension,,
suspension low hack squat with high row,,lower push,strength,low impact,posterior,3,suspension,,
suspension low hack squat with low row,,lower push,strength,low impact,posterior,3,suspension,,
suspension low hack squat,,lower push,strength,low impact,posterior,3,suspension,,
suspension low row hold with alternate single leg squat,,lower push,strength,low impact,posterior,3,suspension,,
suspension low row hold with low hack squat,,lower push,strength,low impact,posterior,3,suspension,,
suspension low row hold,,upper pull,strength,low impact,posterior,3,suspension,,
suspension low squat with bicep curl,,lower push,strength,low impact,posterior,3,suspension,,
suspension low squat with high row,,lower push,strength,low impact,posterior,3,suspension,,
suspension low squat with low row,,lower push,strength,low impact,posterior,3,suspension,,
suspension marching squat hold with bicep curl hold,,lower push,strength,low impact,posterior,3,suspension,,
suspension mountain climbers,,,,low impact,,2,suspension,med ball,
suspension narrow grip chest press,,upper push,strength,low impact,anterior,3,suspension,,
suspension narrow grip half rom chest press,,upper push,strength,low impact,anterior,3,suspension,,
suspension plank-ups with feet in straps,,abs,,low impact,anterior,4,suspension,,
suspension plank,,abs,,low impact,anterior,abs,suspension,,
suspension push up hold with high knees and soft elbows,,upper push,strength,low impact,anterior,3,suspension,,
suspension push up hold with high knees at 90 degrees,,upper push,strength,low impact,anterior,3,suspension,,
suspension push up hold with march and soft elbows,,upper push,strength,low impact,anterior,3,suspension,,
suspension push up plank up combo with feet in straps,,upper push,strength,low impact,anterior,2,suspension,med ball,
suspension reverse flye high row combo,,upper pull,strength,low impact,posterior,2,suspension,med ball,
suspension reverse flye,,,,low impact,,3,suspension,,
suspension reverse lunge and bicep curl,,lower push,strength,low impact,posterior,3,suspension,,
suspension reverse lunge with high row,,lower push,strength,low impact,posterior,3,suspension,,
suspension reverse lunge with low row,,lower push,strength,low impact,posterior,3,suspension,,
suspension reverse lunge,,lower push,strength,low impact,posterior,3,suspension,,
suspension single leg squat left,,lower push,strength,low impact,posterior,3,suspension,,
suspension single leg squat right,,lower push,strength,low impact,posterior,3,suspension,,
suspension speed squat,,lower push,strength,low impact,posterior,3,suspension,,
suspension squat hold with bicep curl,,lower push,strength,low impact,posterior,3,suspension,,
suspension squat hold with high row low row combo,,lower push,strength,low impact,posterior,2,suspension,med ball,
suspension squat hold with low row,,lower push,strength,low impact,posterior,3,suspension,,
suspension squat hold with partial rep high row,,lower push,strength,low impact,posterior,3,suspension,,
suspension squat hold with partial rep low row,,lower push,strength,low impact,posterior,3,suspension,,
suspension squat hold,,lower push,strength,low impact,posterior,3,suspension,,
suspension squat with bicep curl,,lower push,strength,low impact,posterior,3,suspension,,
suspension squat with high row,,lower push,strength,low impact,posterior,3,suspension,,
suspension squat with low row,,lower push,strength,low impact,posterior,3,suspension,,
suspension squat with reverse flye,,lower push,strength,low impact,posterior,3,suspension,,
suspension squat with straight arm front raise,,lower push,strength,low impact,anterior,3,suspension,,
suspension squat with y flye,,lower push,strength,low impact,posterior,3,suspension,,
suspension squat,,lower push,strength,low impact,posterior,3,suspension,,
suspension straight arm front raise,,,,low impact,,3,suspension,,
suspension tricep extension,,upper push,strength,low impact,posterior,3,suspension,,
suspension v sit hold with front press,,abs,strength,low impact,anterior,4,suspension,,
suspension y flye,,,,low impact,,3,suspension,,
upper body crunch with feet off floor,,abs,strength,low impact,anterior,abs,BW,,
upper body twist crunch right with feet on floor,,abs,strength,low impact,anterior,4,BW,,
versa log squat with oh press and vertical log squeeze,,upper push,strength,low impact,anterior,4,versabag,,
wall calf raise,,,,low impact,,1,BW,,
wall march,,,,low impact,,4,BW,,
wall push ups,,upper push,strength,low impact,anterior,5,BW,,
wall runs,,lower pull,cardio,low impact,posterior,1,BW,,
wall sit with bag squeeze,,lower push,strength,low impact,anterior,1,BW,,
wall sit with foam roll,,lower push,strength,low impact,anterior,5,BW,,
wall sit,,lower push,strength,low impact,anterior,4,BW,,
wall ups max height,,,,low impact,,4,BW,,
wall ups,,,,low impact,,4,BW,,
windshield wipers,,,,low impact,,5,BW,,
wp oh squats,,lower push,strength,low impact,posterior,,plate,,
band high alternating supinated band rows start in,,upper pull,strength,low impact,posterior,4,band,,
band high band 1 arm row right,,upper pull,strength,low impact,posterior,4,band,,
band high band alt lat pulldowns and arms start down,,,,low impact,,4,band,,
band high band alt lat pulldowns arms start up,,upper push,cardio,high impact,anterior,4,band,,
band high band continuous squat with row and row as you stand,,lower push,strength,low impact,posterior,4,band,,
band high band half hack squat hold with supinated row,,lower push,strength,low impact,posterior,4,band,,
band high band half lunge hold with one arm lat sweep left,,lower push,strength,low impact,posterior,4,band,,
band high band half lunge hold with one arm lat sweep right,,lower push,strength,low impact,posterior,4,band,,
band high band high row hold with reverse lunge,,lower push,strength,low impact,posterior,4,band,,
band high band lat pulldown,,,,low impact,,4,band,,
band high band lat sweep,,,,low impact,,4,band,,
band high band lunge hold with one arm lat sweep with left,,lower push,strength,low impact,posterior,4,band,,
band high band lunge hold with one arm lat sweep with right,,lower push,strength,low impact,posterior,4,band,,
band high band overhead tricep extension,,upper push,strength,low impact,posterior,4,band,,
band high band row hold with alternating one arm row,,upper pull,strength,low impact,posterior,4,band,,
band high band row hold with bw squats,,lower push,strength,low impact,posterior,4,band,,
band high band squat with row at bottom,,lower push,strength,low impact,posterior,4,band,,
band high hack squat hold with row,,lower push,strength,low impact,posterior,4,band,,
band high hack squat hold with supinated row,,lower push,strength,low impact,posterior,4,band,,
band high hack squat with band sweep as you stand,,lower push,strength,low impact,posterior,4,band,,
band high half hack squat hold with row,,lower push,strength,low impact,posterior,4,band,,
band high half hack squat hold with supinated row,,lower push,strength,low impact,posterior,4,band,,
band high half squat hold with supinated row,,lower push,strength,low impact,posterior,4,band,,
band high half sumo squat hold with row,,lower push,strength,low impact,posterior,4,band,,
band high half sumo squat hold with supinated row,,lower push,strength,low impact,posterior,4,band,,
band high reverse lunge with row at bottom right,,lower push,strength,low impact,posterior,4,band,,
band high reverse lunge with row at top right,,lower push,strength,low impact,posterior,4,band,,
band high reverse lunge with row at top with left,,lower push,strength,low impact,posterior,4,band,,
band high speed row,,upper pull,strength,low impact,posterior,4,band,,
band high squat with supinated row at bottom,,lower push,strength,low impact,posterior,4,band,,
band high sumo squat hold with supinated row,,lower push,strength,low impact,posterior,4,band,,
band high supinated lat pulldown,,upper push,cardio,high impact,anterior,4,band,,
band high supinated row,,upper pull,strength,low impact,posterior,4,band,,
band high supinated speed row,,upper pull,strength,low impact,posterior,4,band,,
band low alternating supinated band rows start in,,upper pull,strength,low impact,posterior,4,band,,
band low band continuous squat with row row as you stand,,lower push,strength,low impact,posterior,4,band,,
band low band high row hold with reverse lunge,,lower push,strength,low impact,posterior,4,band,,
band low band low to high chest press,,upper push,strength,low impact,anterior,4,band,,
band low band one arm row right,,upper pull,strength,low impact,posterior,4,band,,
band low band row hold with bw squats,,lower push,strength,low impact,posterior,4,band,,
band low band squat with row at bottom,,lower push,strength,low impact,posterior,4,band,,
band low band y flye,,,,low impact,,4,band,,
band low hack squat hold with row,,lower push,strength,low impact,posterior,4,band,,
band low hack squat hold with supinated row,,lower push,strength,low impact,posterior,4,band,,
band low half hack squat hold with row,,lower push,strength,low impact,posterior,4,band,,
band low half hack squat hold with supinated row,,lower push,strength,low impact,posterior,4,band,,
